{
 "authority": {
  "can_decide_deck": false,
  "can_reopen_m2": false,
  "can_rewrite_blueprint": false
 },
 "blueprint_version": 1,
 "candidates": [],
 "canonical_hash": "lh1:f5190339a7e9ccc3e5331a401e13f79d1d8dbabed8c81bcb917f6f24d04c3b74",
 "deck_id": "Garza_Zol__Plague_Queen",
 "materiality_policy": {
  "material_fields": [
   "commander_role",
   "dependency_level",
   "power",
   "anti_goals",
   "packages",
   "requirements",
   "win_conditions",
   "construction_rules"
  ],
  "rule": "Classification-only overlays do not reopen M2. Any proposed correction touching a material field requires targeted Cory review/reopen before application; downstream artifacts regenerate either way."
 },
 "schema_version": 1,
 "slug": "garza-zol-plague-queen",
 "status": "provisional_overlay",
 "summary": {
  "candidate_count": 0,
  "compact_candidate_count": 0,
  "m2_reopen_requested": false,
  "material_blueprint_changes_proposed": 0
 }
}
